{
  "action_id": "act_write_parser_fix",
  "session_id": "sess_01J8Z4",
  "tool_id": "tool:fs.write",
  "action_type": "write",
  "target": {
    "resource_kind": "file_path",
    "resource_id": "/workspace/beateros/crates/parser/src/lexer.rs"
  },
  "inputs_digest": "sha256:6b86b273ff34fce19d6b804eff5a3f5747ada4eaa22f1d49c01e52ddb7875b4b",
  "inputs_summary": "Patch off-by-one in lexer span calculation.",
  "expected_outputs": ["Updated lexer.rs with corrected span math."],
  "expected_side_effects": ["local_write"],
  "required_grants": ["grant_repo_rw_01"],
  "risk_class": "low",
  "data_classes": ["code"],
  "idempotency_key": "act_write_parser_fix:v1",
  "compensation_plan": "Revert the file to its pre-write content hash if the test still fails."
}
